{
  "schemaVersion": "2.0",
  "ontologyVersion": "dora-ontology-v2-candidate",
  "reviewStatus": "candidate_for_review",
  "materialInput": "a00-v1-candidate",
  "conceptTypes": [
    "Metric",
    "Dimension",
    "Region",
    "Procedure",
    "Collection",
    "Rule"
  ],
  "instanceTypes": [
    "MetricObservation",
    "InsightOccurrence",
    "Snapshot",
    "WatchTarget",
    "WatchEvent",
    "ActionCase",
    "Lesson"
  ],
  "concepts": [
    {
      "id": "metric.margin",
      "type": "Metric",
      "name": "利润率",
      "aliases": [
        "利润占比"
      ],
      "sourceRefs": [
        "backend/app/engine/engine.py",
        "backend/app/seed.py"
      ],
      "meaning": "项目 margin 序列；财务分子分母未声明，不能等同毛利率或净利率。",
      "metricBinding": {
        "metricKey": "margin",
        "dimension": "全国",
        "sourceUnit": "%",
        "dimensionPolicy": "fixed",
        "semanticStatus": "operational_only",
        "tool": "query_metric"
      }
    },
    {
      "id": "metric.returns",
      "type": "Metric",
      "name": "退货率",
      "aliases": [
        "退货占比"
      ],
      "sourceRefs": [
        "backend/app/engine/engine.py",
        "backend/app/seed.py"
      ],
      "meaning": "当前 returns 是门店序列；没有全国退货率聚合算法；不等同退款率。",
      "metricBinding": {
        "metricKey": "returns",
        "dimension": null,
        "sourceUnit": "%",
        "dimensionPolicy": "store_or_all_rows",
        "semanticStatus": "operational_only",
        "tool": "query_metric"
      }
    },
    {
      "id": "metric.orders",
      "type": "Metric",
      "name": "订单量",
      "aliases": [
        "订单数",
        "销量订单"
      ],
      "sourceRefs": [
        "backend/app/engine/engine.py",
        "backend/app/seed.py"
      ],
      "meaning": "全国订单计数；华东切片使用独立存储 key。",
      "metricBinding": {
        "metricKey": "orders",
        "dimension": "全国",
        "sourceUnit": null,
        "dimensionPolicy": "fixed_with_east_view",
        "semanticStatus": "operational_only",
        "tool": "query_metric"
      }
    },
    {
      "id": "metric.revenue",
      "type": "Metric",
      "name": "营收",
      "aliases": [
        "销售额",
        "营业收入"
      ],
      "sourceRefs": [
        "backend/app/engine/engine.py",
        "backend/app/seed.py"
      ],
      "meaning": "项目 revenue 全国收入序列；含税与确认口径需业务声明。",
      "metricBinding": {
        "metricKey": "revenue",
        "dimension": "全国",
        "sourceUnit": "千元",
        "dimensionPolicy": "fixed",
        "semanticStatus": "operational_only",
        "tool": "query_metric"
      }
    },
    {
      "id": "metric.aov",
      "type": "Metric",
      "name": "客单价",
      "aliases": [
        "平均订单金额",
        "AOV"
      ],
      "sourceRefs": [
        "backend/app/engine/engine.py",
        "backend/app/seed.py"
      ],
      "meaning": "读取项目 aov 序列，分母/有效订单范围仍需业务确认。",
      "metricBinding": {
        "metricKey": "aov",
        "dimension": "全国",
        "sourceUnit": "元",
        "dimensionPolicy": "fixed",
        "semanticStatus": "operational_only",
        "tool": "query_metric"
      }
    },
    {
      "id": "metric.east_orders",
      "type": "Metric",
      "name": "华东订单量",
      "aliases": [
        "华东订单",
        "东区订单"
      ],
      "sourceRefs": [
        "backend/app/engine/engine.py",
        "backend/app/seed.py"
      ],
      "meaning": "项目 east_orders 华东订单序列；不能改用 orders+华东猜测等价。",
      "metricBinding": {
        "metricKey": "east_orders",
        "dimension": "华东",
        "sourceUnit": null,
        "dimensionPolicy": "fixed",
        "semanticStatus": "operational_only",
        "tool": "query_metric"
      }
    },
    {
      "id": "metric.new_sku",
      "type": "Metric",
      "name": "新品销量",
      "aliases": [
        "新品销售量"
      ],
      "sourceRefs": [
        "backend/app/engine/engine.py",
        "backend/app/seed.py",
        "backend/app/engine/dataset.py"
      ],
      "meaning": "项目 key 名保留 new_sku；种子与引擎描述的是新品销量，不是 SKU 种数。新品窗口与实际销量单位待确认。",
      "metricBinding": {
        "metricKey": "new_sku",
        "dimension": "全区域",
        "sourceUnit": null,
        "dimensionPolicy": "fixed",
        "semanticStatus": "operational_only",
        "tool": "query_metric"
      }
    },
    {
      "id": "metric.high_value",
      "type": "Metric",
      "name": "高客单门店占比",
      "aliases": [
        "高客单门店比例"
      ],
      "sourceRefs": [
        "backend/app/engine/engine.py",
        "backend/app/seed.py",
        "backend/app/engine/dataset.py"
      ],
      "meaning": "项目 high_value 是全国百分比序列；不等同门店集合或大额订单占比，分子分母阈值待业务确认。",
      "metricBinding": {
        "metricKey": "high_value",
        "dimension": "全国",
        "sourceUnit": "%",
        "dimensionPolicy": "fixed",
        "semanticStatus": "operational_only",
        "tool": "query_metric"
      }
    },
    {
      "id": "metric.supplier_price",
      "type": "Metric",
      "name": "供应商价格",
      "aliases": [
        "采购价格"
      ],
      "sourceRefs": [
        "backend/app/engine/engine.py",
        "backend/app/seed.py"
      ],
      "meaning": "项目 supplier_price 是供应商维度价格序列；商品规格和币种不能凭名称推定。",
      "metricBinding": {
        "metricKey": "supplier_price",
        "dimension": null,
        "sourceUnit": "元",
        "dimensionPolicy": "supplier_or_all_rows",
        "semanticStatus": "operational_only",
        "tool": "query_metric"
      }
    },
    {
      "id": "metric.store_cluster",
      "type": "Collection",
      "name": "门店集群",
      "aliases": [
        "门店聚类"
      ],
      "sourceRefs": [
        "backend/app/repository.py",
        "backend/app/engine/engine.py"
      ],
      "meaning": "门店行集合与描述性分组；保留旧逻辑 ID，但它不是可通过 query_metric(store_cluster) 读取的指标序列。",
      "metricBinding": null
    },
    {
      "id": "procedure.watch",
      "type": "Procedure",
      "name": "持续关注",
      "aliases": [
        "盯盘",
        "提醒",
        "Watch"
      ],
      "sourceRefs": [
        "knowledge/documents.json"
      ],
      "meaning": "关注流程概念，不是具体 WatchTarget 实例。",
      "metricBinding": null
    },
    {
      "id": "procedure.action",
      "type": "Procedure",
      "name": "行动回路",
      "aliases": [
        "行动档案",
        "处理闭环"
      ],
      "sourceRefs": [
        "knowledge/documents.json"
      ],
      "meaning": "行动处理流程概念，不是某个 ActionCase。",
      "metricBinding": null
    },
    {
      "id": "procedure.evidence",
      "type": "Procedure",
      "name": "证据链",
      "aliases": [
        "证据",
        "依据"
      ],
      "sourceRefs": [
        "knowledge/documents.json"
      ],
      "meaning": "证据阅读流程概念，不是不可变 Snapshot。",
      "metricBinding": null
    },
    {
      "id": "procedure.lesson",
      "type": "Procedure",
      "name": "经验沉淀",
      "aliases": [
        "沉淀经验"
      ],
      "sourceRefs": [
        "knowledge/documents.json"
      ],
      "meaning": "从已验证归档产生候选经验的流程，不代表某条经验已发生。",
      "metricBinding": null
    },
    {
      "id": "procedure.upload",
      "type": "Procedure",
      "name": "数据上传",
      "aliases": [
        "上传数据"
      ],
      "sourceRefs": [
        "knowledge/documents.json"
      ],
      "meaning": "上传校验与更新流程，不是数据更新事件实例。",
      "metricBinding": null
    },
    {
      "id": "region.national",
      "type": "Region",
      "name": "全国",
      "aliases": [],
      "sourceRefs": [
        "backend/app/seed.py"
      ],
      "meaning": "区域/汇总范围词 全国；不是授权 scopeId，不代表所有指标都支持此范围。",
      "metricBinding": null
    },
    {
      "id": "region.east",
      "type": "Region",
      "name": "华东",
      "aliases": [],
      "sourceRefs": [
        "backend/app/seed.py"
      ],
      "meaning": "区域/汇总范围词 华东；不是授权 scopeId，不代表所有指标都支持此范围。",
      "metricBinding": null
    },
    {
      "id": "region.south",
      "type": "Region",
      "name": "华南",
      "aliases": [],
      "sourceRefs": [
        "backend/app/seed.py"
      ],
      "meaning": "区域/汇总范围词 华南；不是授权 scopeId，不代表所有指标都支持此范围。",
      "metricBinding": null
    },
    {
      "id": "region.north",
      "type": "Region",
      "name": "华北",
      "aliases": [],
      "sourceRefs": [
        "backend/app/seed.py"
      ],
      "meaning": "区域/汇总范围词 华北；不是授权 scopeId，不代表所有指标都支持此范围。",
      "metricBinding": null
    },
    {
      "id": "region.southwest",
      "type": "Region",
      "name": "西南",
      "aliases": [],
      "sourceRefs": [
        "backend/app/seed.py"
      ],
      "meaning": "区域/汇总范围词 西南；不是授权 scopeId，不代表所有指标都支持此范围。",
      "metricBinding": null
    },
    {
      "id": "region.all",
      "type": "Region",
      "name": "全区域",
      "aliases": [],
      "sourceRefs": [
        "backend/app/seed.py"
      ],
      "meaning": "区域/汇总范围词 全区域；不是授权 scopeId，不代表所有指标都支持此范围。",
      "metricBinding": null
    },
    {
      "id": "dimension.region",
      "type": "Dimension",
      "name": "区域维度",
      "aliases": [],
      "sourceRefs": [
        "backend/app/seed.py"
      ],
      "meaning": "维度轴概念；具体维度值或周期在业务行中，不在本体里伪造实例。",
      "metricBinding": null
    },
    {
      "id": "dimension.store",
      "type": "Dimension",
      "name": "门店维度",
      "aliases": [],
      "sourceRefs": [
        "backend/app/seed.py"
      ],
      "meaning": "维度轴概念；具体维度值或周期在业务行中，不在本体里伪造实例。",
      "metricBinding": null
    },
    {
      "id": "dimension.supplier",
      "type": "Dimension",
      "name": "供应商维度",
      "aliases": [],
      "sourceRefs": [
        "backend/app/seed.py"
      ],
      "meaning": "维度轴概念；具体维度值或周期在业务行中，不在本体里伪造实例。",
      "metricBinding": null
    },
    {
      "id": "dimension.period",
      "type": "Dimension",
      "name": "周期维度",
      "aliases": [],
      "sourceRefs": [
        "backend/app/seed.py"
      ],
      "meaning": "维度轴概念；具体维度值或周期在业务行中，不在本体里伪造实例。",
      "metricBinding": null
    },
    {
      "id": "metric.gross_margin",
      "type": "Metric",
      "name": "毛利率",
      "aliases": [],
      "sourceRefs": [
        "knowledge/ontology/ontology.json",
        "backend/app/watch/parser.py"
      ],